{
  "rolle": "trend",
  "issue": "SIN-575",
  "zeitpunkt": "2026-10-13T09:00:00Z",
  "status": "fertig",
  "zusammenfassung": "Fixture: ein Fund aus GitHub, Beispieldaten ohne Aussagekraft.",
  "naechster_schritt": "Visionär sortiert den Fund in die nächste Version.",
  "kosten_eur": 0.01,
  "quellen": ["https://github.com/example/beispiel"],
  "funde": [
    {
      "id": "github:example/beispiel",
      "quelle": "github",
      "was": "example/beispiel",
      "url": "https://github.com/example/beispiel",
      "lizenz": "MIT",
      "sterne": 2400,
      "zuwachs": 0.4,
      "aktiv": true,
      "betrifft": "leitstand",
      "nutzen": "Beispiel: ersetzt eigenen Code.",
      "aufwand_tage": 2,
      "risiko": "niedrig",
      "empfehlung": "version",
      "jetzt_grund": null,
      "datum": "2026-10-13"
    }
  ]
}
